{
  "$schema": "http://json-schema.org/draft-07/schema#",
  "$id": "https://raw.githubusercontent.com/0xio-xyz/Token-lists/main/schema.json",
  "title": "0xio Token List",
  "description": "Schema for lists of tokens compatible with 0xio Wallet and Octra Network",
  "definitions": {
    "Version": {
      "type": "object",
      "description": "The version of the list, used in change detection",
      "examples": [
        {
          "major": 1,
          "minor": 0,
          "patch": 0
        }
      ],
      "additionalProperties": false,
      "properties": {
        "major": {
          "type": "integer",
          "description": "The major version of the list. Must be incremented when tokens are removed from the list or token addresses are changed.",
          "minimum": 0,
          "examples": [1, 2]
        },
        "minor": {
          "type": "integer",
          "description": "The minor version of the list. Must be incremented when tokens are added to the list.",
          "minimum": 0,
          "examples": [0, 1]
        },
        "patch": {
          "type": "integer",
          "description": "The patch version of the list. Must be incremented for any changes to the list.",
          "minimum": 0,
          "examples": [0, 1]
        }
      },
      "required": ["major", "minor", "patch"]
    },
    "TagIdentifier": {
      "type": "string",
      "description": "The unique identifier of a tag",
      "minLength": 1,
      "maxLength": 10,
      "pattern": "^[\\w]+$",
      "examples": ["native", "stablecoin", "defi"]
    },
    "TagDefinition": {
      "type": "object",
      "description": "Definition of a tag that can be associated with a token via its identifier",
      "additionalProperties": false,
      "properties": {
        "name": {
          "type": "string",
          "description": "The name of the tag",
          "pattern": "^[ \\w]+$",
          "minLength": 1,
          "maxLength": 20
        },
        "description": {
          "type": "string",
          "description": "A user-friendly description of the tag",
          "pattern": "^[ \\w\\.,:]+$",
          "minLength": 1,
          "maxLength": 200
        }
      },
      "required": ["name", "description"],
      "examples": [
        {
          "name": "Stablecoin",
          "description": "Tokens pegged to USD"
        }
      ]
    },
    "TokenInfo": {
      "type": "object",
      "description": "Metadata for a single token in a token list",
      "additionalProperties": false,
      "properties": {
        "network": {
          "type": "string",
          "description": "The network identifier where this token is deployed",
          "pattern": "^[a-z0-9-]+$",
          "examples": ["octra-testnet", "octra-mainnet"]
        },
        "address": {
          "type": "string",
          "description": "The address of the token contract (or 'native' for OCT)",
          "pattern": "^(oct[A-Za-z0-9]{44}|native)$",
          "examples": ["octBUHw585BrAMPMLQvGuWx4vqEsybYH9N7a3WNj1WBwrDn", "native"]
        },
        "symbol": {
          "type": "string",
          "description": "The symbol for the token; must be alphanumeric",
          "pattern": "^[a-zA-Z0-9+\\-%/]+$",
          "minLength": 1,
          "maxLength": 20,
          "examples": ["OCT"]
        },
        "name": {
          "type": "string",
          "description": "The name of the token",
          "minLength": 1,
          "maxLength": 40,
          "pattern": "^[ \\w.'+\\-%/À-ÖØ-öø-ÿ:]+$",
          "examples": ["Octra"]
        },
        "decimals": {
          "type": "integer",
          "description": "The number of decimals for the token balance",
          "minimum": 0,
          "maximum": 255,
          "examples": [6, 18]
        },
        "logoURI": {
          "type": "string",
          "description": "A URI to the token logo asset",
          "format": "uri",
          "examples": ["https://example.com/logo.png"]
        },
        "tags": {
          "type": "array",
          "description": "An array of tag identifiers associated with the token",
          "items": {
            "$ref": "#/definitions/TagIdentifier"
          },
          "maxItems": 10,
          "examples": [["native"], ["stablecoin", "defi"]]
        },
        "extensions": {
          "type": "object",
          "description": "Extension fields for additional token metadata",
          "properties": {
            "website": {
              "type": "string",
              "description": "Official website URL",
              "format": "uri"
            },
            "description": {
              "type": "string",
              "description": "Token description",
              "maxLength": 500
            },
            "explorer": {
              "type": "string",
              "description": "Block explorer URL",
              "format": "uri"
            },
            "twitter": {
              "type": "string",
              "description": "Twitter profile URL",
              "format": "uri"
            },
            "telegram": {
              "type": "string",
              "description": "Telegram group URL",
              "format": "uri"
            },
            "discord": {
              "type": "string",
              "description": "Discord server URL",
              "format": "uri"
            },
            "coingeckoId": {
              "type": "string",
              "description": "CoinGecko token ID"
            },
            "coinmarketcapId": {
              "type": "string",
              "description": "CoinMarketCap token ID"
            },
            "bridgeInfo": {
              "type": "object",
              "description": "Information about bridged tokens",
              "properties": {
                "originChainId": {
                  "type": "integer"
                },
                "originAddress": {
                  "type": "string"
                },
                "originSymbol": {
                  "type": "string"
                }
              }
            }
          }
        }
      },
      "required": ["network", "address", "symbol", "name", "decimals"]
    }
  },
  "type": "object",
  "additionalProperties": false,
  "properties": {
    "name": {
      "type": "string",
      "description": "The name of the token list",
      "minLength": 1,
      "maxLength": 40,
      "pattern": "^[\\w ]+$",
      "examples": ["0xio Default List"]
    },
    "version": {
      "$ref": "#/definitions/Version"
    },
    "timestamp": {
      "type": "string",
      "format": "date-time",
      "description": "The timestamp of this list version; i.e. when this immutable version of the list was created"
    },
    "logoURI": {
      "type": "string",
      "description": "A URI for the logo of the token list",
      "format": "uri",
      "examples": ["https://example.com/logo.png"]
    },
    "keywords": {
      "type": "array",
      "description": "Keywords associated with the contents of the list; may be used in list discoverability",
      "items": {
        "type": "string",
        "description": "A keyword to describe the contents of the list",
        "minLength": 1,
        "maxLength": 20,
        "pattern": "^[\\w ]+$",
        "examples": ["octra", "default", "tokens"]
      },
      "maxItems": 20,
      "uniqueItems": true
    },
    "tags": {
      "type": "object",
      "description": "A mapping of tag identifiers to their name and description",
      "propertyNames": {
        "$ref": "#/definitions/TagIdentifier"
      },
      "additionalProperties": {
        "$ref": "#/definitions/TagDefinition"
      },
      "maxProperties": 20,
      "examples": [
        {
          "stablecoin": {
            "name": "Stablecoin",
            "description": "Tokens pegged to USD"
          }
        }
      ]
    },
    "tokens": {
      "type": "array",
      "description": "The list of tokens included in the list",
      "items": {
        "$ref": "#/definitions/TokenInfo"
      },
      "minItems": 1,
      "maxItems": 10000
    }
  },
  "required": ["name", "version", "timestamp", "tokens"]
}
